{
  "schema_version": "1.0",
  "target_group": "APT28",
  "doc_ids": [
    "apt28_080"
  ],
  "chunks": [
    {
      "chunk_id": "apt28_080_c001",
      "doc_id": "apt28_080",
      "char_start": 0,
      "char_end": 21738,
      "note": "当前文档长度约 21.7k 字符，作为单 chunk 标注；正式后端切块超过阈值时应继续使用 doc_id_cNNN。",
      "entities": [
        {
          "name": "Sofacy",
          "type": "APT_GROUP",
          "aliases": [
            "APT28",
            "Fancy Bear",
            "STRONTIUM",
            "Sednit",
            "Tsar Team",
            "Pawn Storm"
          ],
          "evidence_text": "The Sofacy group (AKA APT28, Fancy Bear, STRONTIUM, Sednit, Tsar Team, Pawn Storm) is a well-known adversary that remains highly active in the new calendar year of 2018.",
          "char_start": 381,
          "char_end": 550
        },
        {
          "name": "Unit 42",
          "type": "ORGANIZATION",
          "aliases": [],
          "evidence_text": "Unit 42 actively monitors this group",
          "char_start": 551,
          "char_end": 587
        },
        {
          "name": "Ministries of Foreign Affairs",
          "type": "ORGANIZATION",
          "aliases": [],
          "evidence_text": "a campaign launched at various Ministries of Foreign Affairs around the world.",
          "char_start": 683,
          "char_end": 761
        },
        {
          "name": "government institutions",
          "type": "ORGANIZATION",
          "aliases": [],
          "evidence_text": "we discovered an attack targeting two government institutions related to foreign affairs.",
          "char_start": 1092,
          "char_end": 1181
        },
        {
          "name": "Europe",
          "type": "REGION",
          "aliases": [],
          "evidence_text": "one organization is geographically located in Europe",
          "char_start": 1314,
          "char_end": 1366
        },
        {
          "name": "North America",
          "type": "REGION",
          "aliases": [],
          "evidence_text": "the other in North America.",
          "char_start": 1371,
          "char_end": 1398
        },
        {
          "name": "phishing email",
          "type": "TECHNIQUE",
          "aliases": [
            "spear-phishing"
          ],
          "evidence_text": "The initial attack vector leveraged a phishing email",
          "char_start": 1399,
          "char_end": 1451
        },
        {
          "name": "Microsoft Excel",
          "type": "TOOL",
          "aliases": [
            "Excel"
          ],
          "evidence_text": "The attachment itself is an Microsoft Excel XLS document that contains malicious macro script.",
          "char_start": 2198,
          "char_end": 2292
        },
        {
          "name": "certutil",
          "type": "TOOL",
          "aliases": [],
          "evidence_text": "The macro then uses the command certutil -decode to decode the contents of this text file",
          "char_start": 3842,
          "char_end": 3931
        },
        {
          "name": "SofacyCarberp",
          "type": "MALWARE",
          "aliases": [],
          "evidence_text": "The cdnver.dll payload installed by the loader executable is a variant of the SofacyCarberp payload, which is used extensively by the Sofacy threat group.",
          "char_start": 4965,
          "char_end": 5119
        },
        {
          "name": "Carberp",
          "type": "MALWARE",
          "aliases": [],
          "evidence_text": "Previous versions of this Trojan used code taken from the leaked Carberp source code",
          "char_start": 14652,
          "char_end": 14736
        },
        {
          "name": "Luckystrike",
          "type": "TOOL",
          "aliases": [
            "LuckyStrike"
          ],
          "evidence_text": "It appears that Sofacy may have used an open-source tool called Luckystrike to generate the delivery document and/or the macro used in this attack.",
          "char_start": 5811,
          "char_end": 5958
        },
        {
          "name": "PowerShell",
          "type": "TOOL",
          "aliases": [],
          "evidence_text": "Luckystrike, which was presented at DerbyCon 6 in September 2016, is a Microsoft PowerShell-based tool that generates malicious delivery documents by allowing a user to add a macro to an Excel or Word document to execute an embedded payload.",
          "char_start": 5959,
          "char_end": 6200
        },
        {
          "name": "cdnverify[.]net",
          "type": "INFRASTRUCTURE",
          "aliases": [
            "cdnverify.net"
          ],
          "evidence_text": "This variant of SofacyCarberp was configured to use the following domain as its C2 server:\ncdnverify[.]net",
          "char_start": 5288,
          "char_end": 5394
        },
        {
          "name": "hotfixmsupload[.]com",
          "type": "INFRASTRUCTURE",
          "aliases": [
            "hotfixmsupload.com"
          ],
          "evidence_text": "Hotfixmsupload[.]com is particularly interesting as it has been identified as a Sofacy C2 domain repeatedly",
          "char_start": 8586,
          "char_end": 8693
        },
        {
          "name": "Palo Alto Networks",
          "type": "ORGANIZATION",
          "aliases": [],
          "evidence_text": "Palo Alto Networks customers are protected from this threat by:",
          "char_start": 9740,
          "char_end": 9803
        },
        {
          "name": "UserInitMprLogonScript",
          "type": "TECHNIQUE",
          "aliases": [],
          "evidence_text": "the loader will add the following registry key UserInitMprLogonScript to HKCU",
          "char_start": 13945,
          "char_end": 14022
        },
        {
          "name": "IHSMarkit",
          "type": "ORGANIZATION",
          "aliases": [],
          "evidence_text": "Jane’s by IHSMarkit is a well-known supplier of information and analysis often times associated with the defense and government sector.",
          "char_start": 1627,
          "char_end": 1762
        },
        {
          "name": "Jane's 360",
          "type": "ORGANIZATION",
          "aliases": [],
          "evidence_text": "a sender address claiming to be from Jane's 360 defense events <events@ihsmarkit.com>",
          "char_start": 1540,
          "char_end": 1625
        },
        {
          "name": "loader Trojan",
          "type": "MALWARE",
          "aliases": [],
          "evidence_text": "The newly dropped executable is a loader Trojan responsible for installing and running the payload of this attack.",
          "char_start": 4122,
          "char_end": 4236
        },
        {
          "name": "iexplore.exe",
          "type": "TOOL",
          "aliases": [],
          "evidence_text": "0xCDCB4E50 - iexplore.exe",
          "char_start": 16992,
          "char_end": 17017
        },
        {
          "name": "firefox.exe",
          "type": "TOOL",
          "aliases": [],
          "evidence_text": "0x70297938 - firefox.exe",
          "char_start": 17018,
          "char_end": 17042
        },
        {
          "name": "chrome.exe",
          "type": "TOOL",
          "aliases": [],
          "evidence_text": "0x723F0158 - chrome.exe",
          "char_start": 17043,
          "char_end": 17066
        },
        {
          "name": "January 30, 2018",
          "type": "TIME",
          "aliases": [],
          "evidence_text": "the domain cdnverify[.]net was registered on January 30, 2018",
          "char_start": 8953,
          "char_end": 9014
        },
        {
          "name": "September 2016",
          "type": "TIME",
          "aliases": [],
          "evidence_text": "Luckystrike, which was presented at DerbyCon 6 in September 2016",
          "char_start": 5959,
          "char_end": 6023
        },
        {
          "name": "February 2018",
          "type": "TIME",
          "aliases": [],
          "evidence_text": "At the beginning of February 2018, we discovered an attack targeting two government institutions",
          "char_start": 1057,
          "char_end": 1153
        },
        {
          "name": "DealersChoice",
          "type": "EVENT",
          "aliases": [],
          "evidence_text": "This executable contains the same decryption algorithm as the loader we analyzed in the DealersChoice attacks in late 2016.",
          "char_start": 10615,
          "char_end": 10738
        },
        {
          "name": "rundll32.exe",
          "type": "TOOL",
          "aliases": [],
          "evidence_text": "start rundll32.exe \"C:\\Users\\user\\AppData\\Local\\cdnver.dll\",#1",
          "char_start": 4621,
          "char_end": 4683
        },
        {
          "name": "explorer.exe",
          "type": "TOOL",
          "aliases": [],
          "evidence_text": "the loader will enumerate the system’s processes searching for explorer.exe. This process was most likely chosen as it typically runs with administrator privileges.",
          "char_start": 13368,
          "char_end": 13532
        },
        {
          "name": "CreateProcessAsUser",
          "type": "TECHNIQUE",
          "aliases": [],
          "evidence_text": "execute the dropped DLL via CreateProcessAsUser",
          "char_start": 13598,
          "char_end": 13645
        },
        {
          "name": "RtlDecompressBuffer",
          "type": "TECHNIQUE",
          "aliases": [],
          "evidence_text": "decompressing it using the RtlDecompressBuffer API",
          "char_start": 11388,
          "char_end": 11438
        },
        {
          "name": "LZNT1",
          "type": "TECHNIQUE",
          "aliases": [],
          "evidence_text": "The compression algorithm used is LZNT1 with maximum compression level.",
          "char_start": 11596,
          "char_end": 11667
        }
      ],
      "relations": [
        {
          "head_name": "Sofacy",
          "head_type": "APT_GROUP",